### ISSUE TITLE
Connectivity does not work between containers

### ISSUE THREAD

**Issue by peter-braun** [Metaswitch/calico-docker-prototype#38]
Following the instructions of L2RoutedPrototype.md I've tried to set up networking between two containers.

The problem is that the IP connectivity does not work between the containers. When I ping one container from the another one, the ping does not succeed. When I try to create TCP connection with netcat, it does not work either.

I've tried to figure out what the problem could be, and I found the following: when I ping / try to connect, the following ARP requests can be seen on tap* interface of the source server (host):

    [root@cali1 tmp]# tcpdump -n -i tap15580dee2f1
    tcpdump: WARNING: tap15580dee2f1: no IPv4 address assigned
    tcpdump: verbose output suppressed, use -v or -vv for full protocol decode
    listening on tap15580dee2f1, link-type EN10MB (Ethernet), capture size 65535 bytes
    09:47:08.645761 ARP, Request who-has 172.16.0.2 tell 172.16.0.1, length 28
    09:47:09.647416 ARP, Request who-has 172.16.0.2 tell 172.16.0.1, length 28
    09:47:10.649496 ARP, Request who-has 172.16.0.2 tell 172.16.0.1, length 28
    09:47:12.646819 ARP, Request who-has 172.16.0.2 tell 172.16.0.1, length 28
    09:47:13.647482 ARP, Request who-has 172.16.0.2 tell 172.16.0.1, length 28
    09:47:14.649476 ARP, Request who-has 172.16.0.2 tell 172.16.0.1, length 28

Neither ARP reply arrives, nor the ARP request can be seen on eth1 (the interface on which the two servers are connected).

ARP table on the source server (host):

    [root@cali1 tmp]# arp -ne
    Address                  HWtype  HWaddress           Flags Mask            Iface
    192.168.2.1              ether   52:54:00:32:06:d7   C                     eth2
    172.16.0.1               ether   72:c7:a0:f5:3c:f0   CM                    tap15580dee2f1
    192.168.1.201            ether   52:54:00:37:cd:33   C                     eth1
    192.168.122.1            ether   fe:54:00:2c:83:6b   C                     eth0

It would be great help for us if you could give some hints how we can solve this problem.

Output of diags.sh:
https://drive.google.com/file/d/0B18zBkhQiWDoVTJQZUJsWThJOFU/view?usp=sharing
https://drive.google.com/file/d/0B18zBkhQiWDoME5iX0NYN2dVMlE/view?usp=sharing

Thanks in advance.
Peter

**Comment by plwhite** [comment]
I think (and haven't time to do more than a quick look right now) the problem here is most likely that you aren't using IP addresses for containers in the 192.168.* range (which is hard-coded into the BIRD configuration).

Did you change the bird config to allow for this address range (by tweaking bird.conf and rebuilding the bird containers)? If not, you should do that. If so, let me know, and I'll dig a bit more.

**Comment by Lukasa** [comment]
@plwhite Really? The lack of ARP replies suggests a proxy-arp problem...

**Comment by peter-braun** [comment]
I believe I did:

    [root@cali1 bird]# cat bird.conf
    router id LOCALADDR;
    log "/var/log/bird/bird.log" all;
    
    # Configure synchronization between routing tables and kernel.
    protocol kernel {
      learn;          # Learn all alien routes from the kernel
      persist;        # Don't remove routes on bird shutdown
      scan time 2;    # Scan kernel routing table every 2 seconds
      import all;
      device routes;
      export all;     # Default is export none
    }
    
    # Watch interface up/down events.
    protocol device {
      scan time 2;    # Scan interfaces every 2 seconds
    }
    
    protocol direct {
       debug all;
       interface "eth*", "em*", "ens*";
    }
    
    # Peer with all neighbours
    protocol bgp bgppeer {
      debug all;
      description "Connection to BGP peer";
      local as 64511;
      neighbor PEERADDR as 64511;
      multihop;
      gateway recursive; # This should be the default, but just in case.
      import where net ~ 172.16.0.0/16;
      export where net ~ 172.16.0.0/16;
      next hop self;    # Disable next hop processing and always advertise our
                        # local address as nexthop
      source address LOCALADDR;  # The local address we use for the TCP connection
    }

Peter

**Comment by plwhite** [comment]
That BIRD config looks right. I'm going to spend a little while looking and see what I can find.

**Comment by plwhite** [comment]
It does indeed look like proxy ARP isn't working, as @Lukasa said, but the Felix code that turns on proxy ARP has worked (based on the logs). `cat /proc/sys/net/ipv4/conf/tap15580dee2f1/proxy_arp` should show 1 (and worth you checking that), but I think it will. I will ask around and see what else I can dig up.

**Comment by peter-braun** [comment]
Indeed. The `proxy_arp` file contains 1 on both nodes.
Thanks assistance in advance.

**Comment by Lukasa** [comment]
What's in `/proc/sys/net/ipv4/conf/tap15580dee2f1/proxy_delay`?

**Comment by peter-braun** [comment]
I've no such file. The content of `/proc/sys/net/ipv4/conf/tap9aa9d798bf9`:

    [root@cali1 tap9aa9d798bf9]# for n in $(ls); do echo -n "$n = "; cat $n;  done
    accept_local = 0
    accept_redirects = 1
    accept_source_route = 0
    arp_accept = 0
    arp_announce = 0
    arp_filter = 0
    arp_ignore = 0
    arp_notify = 0
    bootp_relay = 0
    disable_policy = 0
    disable_xfrm = 0
    force_igmp_version = 0
    forwarding = 0
    log_martians = 0
    mc_forwarding = 0
    medium_id = 0
    promote_secondaries = 0
    proxy_arp = 1
    proxy_arp_pvlan = 0
    route_localnet = 1
    rp_filter = 1
    secure_redirects = 1
    send_redirects = 1
    shared_media = 1
    src_valid_mark = 0
    tag = 0

By the way I'm using RHEL 7.0.

There is also one thing what I still don't understand in the Calico's concept: you name the interface on the host like `tap{...}`, but is isn't really a `tap` interface. It's one end of a `veth` interface (the other end is in the container). But where this `tap{...}` interface is connected to? I mean if a process in the container sends frames (packets) to its end of the `veth`, those frames will be outbound frames on the `tap{...}` interface. So where these frames are forwarded by whom?

Sorry for that dummy question... :)

**Comment by Lukasa** [comment]
I'll answer your questions first. =)

> There is also one thing what I still don't understand in the Calico's concept: you name the interface on the host like tap{...}, but is isn't really a tap interface. It's one end of a veth interface (the other end is in the container).

Correct. The name of the interface is a holdover from earlier in our development cycle where we only worked with VMs, which really do use tap interfaces. The naming system is just hard coded at the minute. It's a smallish change to have the interface name be dynamic, and then we won't call these `tap` devices anymore!

> But where this tap{...} interface is connected to? I mean if a process in the container sends frames (packets) to its end of the veth, those frames will be outbound frames on the tap{...} interface. So where these frames are forwarded by whom?

Good question. The packets are meant to be forwarded by the Linux vRouter. We do this by setting the `forwarding` attribute to 1. I've just noticed in your procfs output that forwarding is set to 0 on your 'tap' interface. This means you have packet forwarding off, which is likely the source of your problem.

Try running this:

```bash
$ echo "1" > /proc/sys/net/ipv4/conf/tap9aa9d798bf9/forwarding
```

For every currently existing tap interface on each machine and try your pings again. If that works, you need to enable your IP forwarding more generally. Try this:

```bash
$ echo "net.ipv4.ip_forward=1" >> /etc/sysctl.conf
$ echo "net.ipv6.conf.all.forwarding=1" >> /etc/sysctl.conf
$ sysctl -p
```

**Comment by plwhite** [comment]
The naming of interfaces issue is here : https://github.com/Metaswitch/calico/issues/61. It's cosmetic but confusing, and I expect we'll be fixing that within the next two to three weeks, now that we have more Docker work going on.

Since we need to have forwarding enabled, we should explicitly set that field if it is set incorrectly. https://github.com/Metaswitch/calico/issues/187

Let us know if this resolves the issue and you are unblocked; we'll be aiming to fix both the referenced issues above in due course.

**Comment by peter-braun** [comment]
Setting the forwarding to "1" on both the `tap` and `eth0` interfaces on both hosts made the connectivity work.

**Comment by ed-harrison** [comment]
@plwhite Presumably this indicates that forwarding support is turned on by default in Ubuntu and CoreOS, but not RHEL.  Can you make sure that this is documented, please?

**Comment by plwhite** [comment]
Yes, will do.

**Comment by Lukasa** [comment]
@peter-braun No problem, thanks for the report!

**Comment by ed-harrison** [comment]
@peter-braun , as Cory says thanks very much for getting in touch to report this issue.  

It would be great to better understand where your interest in Calico has come from, what you're hoping to get out of it and how it's going so far.  Feel free to drop me an email at ed.harrison@metawitch.com to continue this discussion.
